{
  "protocol_version": "jarvis-return-path-v1",
  "project_id": "pulla-reddy",
  "view_id": "V06",
  "layer_id": "03",
  "candidate_sha256": "04a37c428a1ff4f4d88f20d9ce08881534d8874b689d602af9afdc4e1cd9bc45",
  "reviewed_artifact_id": "9344343943",
  "reviewed_workflow_run_id": "32191474510",
  "decision": "REJECT",
  "review_summary": "The concealed under-seater lighting is visually too dominant. The nearly continuous warm luminous ribbon competes with the intended lighting hierarchy rather than quietly supporting the seating.",
  "required_changes": [
    "Reduce perceived under-seater intensity approximately 30–40%.",
    "Pull the brightest emission further underneath the seating.",
    "Conceal the apparent source more convincingly.",
    "Preserve a subtle warm reflected pool on the floor.",
    "Reduce the visual reach of the under-seat glow.",
    "The effect should gently detach the seating from the floor rather than trace the furniture geometry."
  ],
  "hard_locks": [
    "Do not modify wall wash.",
    "Do not modify table lighting.",
    "Do not modify global exposure.",
    "Do not modify global CCT.",
    "Do not modify architecture.",
    "Do not modify materials.",
    "Do not modify camera.",
    "Do not modify crop.",
    "Do not advance to another layer.",
    "Regenerate V06 Layer 03 only."
  ],
  "reviewer": "JARVIS_CHATGPT",
  "reviewed_at": "2026-08-18T22:33:20.974Z",
  "decision_id": "jarvis-v06-l03-04a37c42-reject-001"
}
