{
  "protocol_version": "jarvis-return-path-v1",
  "project_id": "pulla-reddy",
  "view_id": "V01",
  "layer_id": "06",
  "candidate_sha256": "318b1237c35905e21720e8fc38054b4e93fb93202cfca07cd8b2a8233cf14904",
  "reviewed_artifact_id": "9374332164",
  "reviewed_workflow_run_id": "32276889137",
  "decision": "APPROVE",
  "review_summary": "Independent external JARVIS review approves the repaired V01 Layer 06 candidate 318b1237c35905e21720e8fc38054b4e93fb93202cfca07cd8b2a8233cf14904. The exact GitHub Actions artifact 9374332164 from workflow run 32276889137 was downloaded; candidate.png independently hashes to 318b1237c35905e21720e8fc38054b4e93fb93202cfca07cd8b2a8233cf14904, matching the artifact manifest, artifact provenance, active READY_FOR_JARVIS_REVIEW record and repository candidate binding. The exact approved repaired Layer 05 parent artifact was also retrieved and independently verified at SHA-256 f8335d6a5081b096e396a62af688dca39dca95d6a007b08cad4467046b6095ca. Direct visual comparison of the actual parent and candidate confirms that the new contribution is confined to two quiet warm reflected-floor pools beneath the visible rear built-in banquette bays. The source itself remains concealed; no raw LED line, diode texture, luminous ribbon, bright source edge, broad rear-floor wash or nightclub-like floating-bench effect is visible. The pools are presentation-legible in direct comparison but remain deliberately subordinate to the approved rear seating-comfort layer, while the principal sweet counters remain the strongest destination, wall merchandise remains second, central merchandise remains third, and the hospitality zone stays calm. Camera, crop, coordinate frame, architecture, ceiling grid, counters, shelves, products, furniture, previous lighting families, glass/reflection character, overall exposure, gamma and colour balance appear visually frozen outside the physically plausible local under-seater contribution. Added light reads consistently warm and appropriate to the required 3000K character. Deterministic QA independently corroborates the visual review with 0,0 registration, no negative RGB deltas, no changes outside the allowed under-seater zones, no protected-region drift, and only a 0.027577 full-frame mean luminance increase, but approval is based on the actual render comparison rather than QA alone.",
  "required_changes": [],
  "hard_locks": [
    "Candidate 318b1237c35905e21720e8fc38054b4e93fb93202cfca07cd8b2a8233cf14904 is the immutable approved repaired V01 Layer 06 cumulative render and must not be regenerated, rebalanced, shifted, cropped or reinterpreted unless explicitly reopened by JARVIS.",
    "The exact repaired Layer 05 parent f8335d6a5081b096e396a62af688dca39dca95d6a007b08cad4467046b6095ca and all repaired Layer 01 through Layer 05 lighting families remain frozen in camera, geometry, intensity, colour, beam character, reflections and shadow behaviour.",
    "The approved repaired Layer 06 under-seater contribution must remain fully concealed, warm, localized and subordinate. No downstream work may turn it into a visible strip, luminous ribbon, broad floor wash, dramatic floating-bench effect or stronger hospitality feature.",
    "Camera, crop, focal character, perspective, 1624 x 968 coordinate grid, architecture, ceiling grid, counters, shelves, central merchandise, rear seating furniture, products, materials, colours and overall exposure/gamma remain locked.",
    "All added electric lighting in the repaired V01 chain remains 3000K and recessed, concealed or integrated only. No pendant, track, surface fitting, raw LED strip or luminous ceiling-dot condition may be introduced.",
    "Historical defective V01 Layer 06 and historical downstream Final/concept artifacts from the invalidated ancestry remain provenance only and must not be reused as raster parents for the repaired chain.",
    "Any repaired Final/composite or fresh continuity audit must derive from this exact approved repaired Layer 06 parent and must preserve it byte-for-byte except where the task explicitly defines a non-raster communication artifact.",
    "Presentation generation remains locked until every required layer in every required view has its own valid exact candidate-bound independent JARVIS APPROVE decision."
  ],
  "reviewer": "JARVIS_CHATGPT",
  "reviewed_at": "2026-08-19T17:03:16Z",
  "decision_id": "jarvis-v01-l06-318b1237-approve-002"
}
