{
  "protocol_version": "jarvis-return-path-v1",
  "project_id": "pulla-reddy",
  "view_id": "V01",
  "layer_id": "05",
  "candidate_sha256": "f8335d6a5081b096e396a62af688dca39dca95d6a007b08cad4467046b6095ca",
  "reviewed_artifact_id": "9372085257",
  "reviewed_workflow_run_id": "32270868999",
  "decision": "APPROVE",
  "review_summary": "Independent external JARVIS review approves repaired V01 Layer 05 rear-seating comfort candidate f8335d6a5081b096e396a62af688dca39dca95d6a007b08cad4467046b6095ca. JARVIS downloaded exact GitHub Actions artifact 9372085257 and independently SHA-256 verified candidate.png as f8335d6a5081b096e396a62af688dca39dca95d6a007b08cad4467046b6095ca. The exact independently approved repaired Layer 04 parent was separately downloaded from artifact 9369801718 and verified as a3d00e7526313425428e1375d0765ad652a12d9ee43883815a83abacc193ba8e before direct full-resolution parent-versus-candidate inspection. The new contribution is confined to the rear hospitality zone: two soft, restrained warm seating/table pools with minimal nearby floor support make the rear seating comfortably readable while remaining clearly subordinate to the sweet counters, wall merchandise and central freestanding display. In the full frame the retail hierarchy remains intact, with the long sweet counter still dominant, the wall shelf compositions second, central merchandise third and hospitality fourth. The seating contribution reads as calm 3000K comfort light rather than theatrical feature lighting; no pendant, track, surface source, visible ceiling dot, raw LED line or broad ambient wash appears. The wall response is soft enough to remain plausible as local recessed-light spill and does not become a new visual hero. Timber and wall colour remain warm without an excessive orange cast, and the change is presentation-legible without becoming punchy. Camera, crop, perspective, architecture, ceiling grid, counters, shelves, products, furniture, glass/reflection character and all repaired Layers 01 through 04 remain visually frozen. Deterministic QA independently supports the visual inspection with dx=0, dy=0 registration, zero changed pixels outside the released rear zones, zero negative RGB deltas and only 2.855095% changed pixels. No global exposure or gamma lift is apparent.",
  "required_changes": [],
  "hard_locks": [
    "Candidate f8335d6a5081b096e396a62af688dca39dca95d6a007b08cad4467046b6095ca is the immutable approved repaired V01 Layer 05 parent and must not be regenerated, rebalanced, shifted or reinterpreted unless explicitly reopened by JARVIS.",
    "The repaired 1624 x 968 coordinate grid remains authoritative. Camera, crop, focal character, perspective, architecture, ceiling grid, counters, shelves, central merchandise, rear seating furniture, products, materials and colours remain locked for all later V01 work.",
    "Approved Layer 01 counter downlighting, repaired Layer 02 wall-wash, repaired Layer 03 concealed shelf-integrated lighting, repaired Layer 04 central-merchandise/circulation lighting and repaired Layer 05 rear-seating comfort lighting are frozen in intensity, colour, source concealment, beam character, reflections and shadow behaviour except for physically unavoidable interaction from the newly released circuit.",
    "Repaired V01 Layer 06 must equal this exact approved Layer 05 parent plus only restrained concealed 3000K under-seater lighting to the meaningfully visible built-in rear banquette. The source must remain fully hidden and the effect must read as a soft local floor glow, not a luminous ribbon or dramatic floating bench.",
    "Do not brighten the rear wall, tables or chairs to make Layer 06 stronger. The approved Layer 05 seating-comfort pools must remain unchanged except for physically unavoidable local bounce from the under-seater circuit.",
    "All later added electric lighting remains 3000K and recessed, concealed or integrated only. No pendant, track, surface fixture, raw LED strip line, LED-dot texture, glowing ceiling aperture or broad ambient floor wash is permitted.",
    "Do not use global exposure, gamma, contrast or colour shifts to simulate added illumination. Unrelated zones may not brighten, darken or change colour without physical cause.",
    "Historical defective Layer 05, Layer 06 and Final files remain immutable evidence but are invalid as raster parents for the repaired chain.",
    "Presentation generation and contact-sheet/review-board production remain locked until repaired Layer 06, repaired Final and a fresh cross-layer continuity audit are independently approved, and every other required view has its own valid independent completion chain."
  ],
  "reviewer": "JARVIS_CHATGPT",
  "reviewed_at": "2026-08-19T16:13:31Z",
  "decision_id": "jarvis-v01-l05-f8335d6a-approve-002"
}
